Title,Company,Location,Description
Ml Engineer,Client - Saaki,"Hyderabad, Chennai, Bengaluru","We are seeking a highly experienced Machine Learning Engineer to design, develop, and ..."
ML Engineer (ML Ops),Tiger Analytics,"Hybrid - Hyderabad, Chennai, Bengaluru","3+ years of experience in data science, proficient in Python, Pyspark, and AWS cloud te..."
ML Engineer (Fullstack_ Python + React/ Angular),Zetwerk,"Hyderabad, Chennai, Bengaluru",ML Engineer (Fullstack) Hyderabad / Chennai / Bangalore (Hybrid) Who we are Ti...
ML Ops Engineer (Remote),Canibuild Au Pty,"Hyderabad, Kolkata, Mumbai, New Delhi, Pune, Chennai, Bengaluru","Bachelor s / Master s in Computer Science, AI, or related field . 4+ years in MLOps, AI..."
ML Ops engineer,Virtusa,Hyderabad,"Bachelors degree in Computer Science, Information Technology, or a related fieldcertifi..."
Senior ML Engineer,Grid Dynamics,"Hyderabad, Chennai, Bengaluru",Proven experience of design and deployment of end-to-end ML pipelinesExperience deployi...
Senior ML Engineer,Goml,"Hyderabad, Kolkata, Mumbai, New Delhi, Pune, Chennai, Bengaluru","Looking for a culture to thrive & build a rewarding career for yourself, join the core..."
ML Engineer,S&P Global Inc.,Hyderabad,About the Role: Grade Level (for internal use): 09 Job Specification - ML Eng...
ML Engineer (Databricks + PySpark),Leading Client,"Hyderabad, Chennai, Bengaluru",Good knowledge of DS concepts and professional experience in developing and enhancing a...
ML Engineer,Digital Mapout Solutions,Hybrid - Hyderabad,Solid coding and engineering skills preferably in Machine Learning (not mandatory) Prof...
ML Engineer (Databricks + PySpark),Zetwerk,"Hyderabad, Chennai, Bengaluru",Follows good software engineering practices and has an interest in building reliable an...
ML Engineer (ML Ops),Zetwerk,"Hyderabad, Chennai, Bengaluru",Excellent written and verbal communication skills. . BTech from Tier-1 college / MS or ...
ML Engineer (React-Native),Zetwerk,"Hyderabad, Chennai, Bengaluru",Bachelors / Masters Degree in Computer Science / IT with 3+ years of industry experienc...
ML Engineer (Fullstack_ React + Python / Java),Zetwerk,"Hyderabad, Chennai, Bengaluru",ML Engineer (Fullstack) Hyderabad / Chennai / Bangalore (Hybrid) Who we are Ti...
Senior ML Engineer,S&P Global Inc.,Hyderabad,". Have 5+ years of significant, hands-on experience designing, building, evaluating, an..."
ML Engineer,Thryve Digital,Hyderabad,Role Summary:This role demands a machine learning engineer with expertise in machine le...
Ml Engineer,Space Inventive,Hybrid - Hyderabad(Financial District),"Solid experience as a Machine Learning Engineer, with a focus on Gen AI & LLMs suitable..."
ML Engineer,Cognida,Hyderabad,". Should have worked in Generative AI, building annotations, models ML Engineer with 6+..."
ML Engineer,Fusion Plus Solutions,Hyderabad,Detailed JD (Roles and Responsibilities) ML/NLP Developer Mandatory skills ...
ML Engineer - Reinforcement,Appstek Information Services,Hyderabad,3+ years experience working as ML Engineer . Experience in data mining . Understanding ...
